{
  "$schema": "https://json-schema.org/draft/2020-12/schema",
  "$id": "contracts/regime_audit_manifest.schema.v1.json",
  "title": "RegimeAuditManifest",
  "type": "object",
  "additionalProperties": false,
  "required": ["schema_version", "as_of", "inputs_hash", "artifacts"],
  "properties": {
    "schema_version": { "type": "integer", "const": 1 },
    "as_of": { "type": "string", "pattern": "^\\d{4}-\\d{2}-\\d{2}$" },
    "inputs_hash": { "type": "string", "pattern": "^[a-f0-9]{64}$" },
    "artifacts": {
      "type": "object",
      "additionalProperties": false,
      "required": [
        "brief",
        "strategy",
        "trace_strategy_brief",
        "diff_strategy_brief",
        "diff_trace_strategy_brief",
        "markdown"
      ],
      "properties": {
        "brief": {
          "type": "object",
          "additionalProperties": false,
          "required": ["normalized_brief_hash", "inputs_hash"],
          "properties": {
            "normalized_brief_hash": { "type": "string", "pattern": "^[a-f0-9]{64}$" },
            "inputs_hash": { "type": "string", "pattern": "^[a-f0-9]{64}$" }
          }
        },
        "strategy": {
          "type": "object",
          "additionalProperties": false,
          "required": ["normalized_strategy_hash", "inputs_hash", "markdown_hash"],
          "properties": {
            "normalized_strategy_hash": { "type": "string", "pattern": "^[a-f0-9]{64}$" },
            "inputs_hash": { "type": "string", "pattern": "^[a-f0-9]{64}$" },
            "markdown_hash": { "type": ["string", "null"], "pattern": "^[a-f0-9]{64}$" }
          }
        },
        "trace_strategy_brief": {
          "type": "object",
          "additionalProperties": false,
          "required": ["normalized_trace_hash", "inputs_hash"],
          "properties": {
            "normalized_trace_hash": { "type": "string", "pattern": "^[a-f0-9]{64}$" },
            "inputs_hash": { "type": "string", "pattern": "^[a-f0-9]{64}$" }
          }
        },
        "diff_strategy_brief": {
          "type": "object",
          "additionalProperties": false,
          "required": ["normalized_diff_hash", "inputs_hash"],
          "properties": {
            "normalized_diff_hash": { "type": "string", "pattern": "^[a-f0-9]{64}$" },
            "inputs_hash": { "type": "string", "pattern": "^[a-f0-9]{64}$" }
          }
        },
        "diff_trace_strategy_brief": {
          "type": "object",
          "additionalProperties": false,
          "required": ["normalized_diff_hash", "inputs_hash"],
          "properties": {
            "normalized_diff_hash": { "type": "string", "pattern": "^[a-f0-9]{64}$" },
            "inputs_hash": { "type": "string", "pattern": "^[a-f0-9]{64}$" }
          }
        },
        "markdown": {
          "type": "object",
          "additionalProperties": false,
          "required": ["brief_strategy_diff_md_hash", "trace_strategy_diff_md_hash"],
          "properties": {
            "brief_strategy_diff_md_hash": { "type": ["string", "null"], "pattern": "^[a-f0-9]{64}$" },
            "trace_strategy_diff_md_hash": { "type": ["string", "null"], "pattern": "^[a-f0-9]{64}$" }
          }
        }
      }
    }
  }
}
